{
  "$schema": "https://json-schema.org/draft/2020-12/schema",
  "$id": "https://example.com/schemas/workitem.schema.json",
  "title": "WorkItem",
  "type": "object",
  "required": ["id", "title", "description", "url"],
  "properties": {
    "id": { "type": "string" },
    "title": { "type": "string" },
    "description": { "type": "string" },
    "url": { "type": "string", "format": "uri" },
    "kind": { "type": "string" },
    "attributes": { "type": "object", "additionalProperties": true },
    "source": { "type": "string" },
    "updatedAt": { "type": "string", "format": "date-time" },
    "favorite": { "type": "boolean" },
    "archive": { "type": "boolean" },
    "storage": {
      "type": "object",
      "properties": {
        "records": {
          "type": "array",
          "items": {
            "type": "object",
            "properties": {
              "content": {
                "type": "string",
                "description": "记录内容，必须以有效的 8 位日期（YYYYMMDD）开头，长度在 20-500 字符之间"
              },
              "type": { "type": "string" },
              "createdAt": { "type": "string", "format": "date-time" }
            },
            "additionalProperties": true
          }
        }
      },
      "additionalProperties": true
    }
  },
  "additionalProperties": false
}
